{"entries":[{"classification":"explicit_site_input","git_mode":"100644","git_object":"904e767f25da9d560fce295e28293cd2bec1cc5b","path":"calib/_bak/camera_1768054719.yaml","sha256":"b0974fd5c2ce358bd8a6f88ed59cba503365ef30cb7313341d5961cd1109d60e"},{"classification":"explicit_site_input","git_mode":"100644","git_object":"144bac559270c530c6e7fc9119546fdb07dc7562","path":"calib/_bak/camera_1768056304.yaml","sha256":"680df0ae46d51eaca01a87fd15d31ded32a27857022ceead41e990b519e9e8aa"},{"classification":"explicit_site_input","git_mode":"100644","git_object":"7e81d1845a89dce06784899a052bbd27052807a2","path":"calib/_bak/camera_1768057927.yaml","sha256":"c9781c6527c666378860a970a4bc8d161d37d75257a382157a69707b000d9525"},{"classification":"explicit_site_input","git_mode":"100644","git_object":"4f6804bd5e9d988846f3cc3fa96e2767fa6e6929","path":"calib/_bak/mapping_1768055438.yaml","sha256":"fa8abff933a363dc2aff90e6ffd2eb75b0113f213efa37daf1067bb0b3443214"},{"classification":"explicit_site_input","git_mode":"100644","git_object":"4f6804bd5e9d988846f3cc3fa96e2767fa6e6929","path":"calib/_bak/mapping_1768055529.yaml","sha256":"fa8abff933a363dc2aff90e6ffd2eb75b0113f213efa37daf1067bb0b3443214"},{"classification":"explicit_site_input","git_mode":"100644","git_object":"4f6804bd5e9d988846f3cc3fa96e2767fa6e6929","path":"calib/_bak/mapping_1768056341.yaml","sha256":"fa8abff933a363dc2aff90e6ffd2eb75b0113f213efa37daf1067bb0b3443214"},{"classification":"explicit_site_input","git_mode":"100644","git_object":"31cc24a9fdd8a802bf969c0863568c0895045303","path":"calib/_bak/mapping_1768057431.yaml","sha256":"eac3395530eb00bd152557163cd64c8fddc0069c91af7204cfb255d7cc68a6c5"},{"classification":"explicit_site_input","git_mode":"100644","git_object":"31cc24a9fdd8a802bf969c0863568c0895045303","path":"calib/_bak/mapping_1768058086.yaml","sha256":"eac3395530eb00bd152557163cd64c8fddc0069c91af7204cfb255d7cc68a6c5"},{"classification":"explicit_site_input","git_mode":"100644","git_object":"cb12d35e032b014c78b928e209cfd682b6f2cedd","path":"calib/active_profile.yaml","sha256":"c348a39fd4f8c723a0a36c5efe77cce4e666bdcdf6ea1d8cfe47dad8a240302f"},{"classification":"explicit_site_input","git_mode":"100644","git_object":"1d62db4defab20f4df181dfa5a57ab202b2876cf","path":"calib/anchors.yaml","sha256":"53965de53e6f3a343e8a4683dab526aa43c2c6f36bd15250bbfdfe67e07d6e3a"},{"classification":"explicit_site_input","git_mode":"120000","git_object":"87cac445628ad3cbd0241c83417f18f87ead8291","path":"calib/board_110x40","sha256":"73b563b92cf7ef224b97c6cf4fd3382a4da43602d7da6733e59e2c497911b3cf"},{"classification":"explicit_site_input","git_mode":"100644","git_object":"fcb531832ced869a9019864f3406df5c983f7d5c","path":"calib/board_110x40_warehouse_story_v1/anchors.yaml","sha256":"e8d38758729c1c81059e47f3768394d187bca7887f2180ac5e4ad0f3aba63a17"},{"classification":"explicit_site_input","git_mode":"100644","git_object":"e76a41196ec1ca1563d1cad1d348747fe9bd9986","path":"calib/board_110x40_warehouse_story_v1/mapping.yaml","sha256":"3c3b03bd6f9adbcac9cf8f73067c72387a058397be8fe007f6c838e74bb48bac"},{"classification":"explicit_site_input","git_mode":"100644","git_object":"7639db322373634248eaff6635a1f67a604dac5e","path":"calib/board_110x40_warehouse_story_v1/zones.yaml","sha256":"d51e889cc23c807389fc03275198e32b640bc75f104ef0efcf734b489c522260"},{"classification":"explicit_site_input","git_mode":"100644","git_object":"37face3788601684991151dddba712870207f772","path":"calib/camera.yaml","sha256":"beb58af68b1d528a60ee0b6b1f3c32ad4cb0003175d2038236e1a9a6e792c686"},{"classification":"explicit_site_input","git_mode":"100644","git_object":"be255cb09652938cd085f2b50c343dc6909c81f5","path":"calib/mapping.yaml","sha256":"904d9b2e9caab5e05a567ff390f30888d9f5f7d936cfb0d375777eb3fcdd3605"},{"classification":"explicit_site_input","git_mode":"100644","git_object":"281b1fd02a1ce452241ccf3599a2e451205f9836","path":"calib/profiles/board_110x40_warehouse_story_v1/anchors.yaml","sha256":"f409c0865d67592ce85fe5a466030ceecda6170462ab8cf24c01e5ec711eeaca"},{"classification":"explicit_site_input","git_mode":"100644","git_object":"37face3788601684991151dddba712870207f772","path":"calib/profiles/board_110x40_warehouse_story_v1/camera.yaml","sha256":"beb58af68b1d528a60ee0b6b1f3c32ad4cb0003175d2038236e1a9a6e792c686"},{"classification":"explicit_site_input","git_mode":"100644","git_object":"be255cb09652938cd085f2b50c343dc6909c81f5","path":"calib/profiles/board_110x40_warehouse_story_v1/mapping.yaml","sha256":"904d9b2e9caab5e05a567ff390f30888d9f5f7d936cfb0d375777eb3fcdd3605"},{"classification":"explicit_site_input","git_mode":"100644","git_object":"2bce1450184e21b79efbe729796d82e9e9bb593b","path":"calib/profiles/board_110x40_warehouse_story_v1/test_points.yaml","sha256":"c89ea7be81e41cf4fde2857c540a0764b9b3aa48810e300c717b0a9919f43b0c"},{"classification":"explicit_site_input","git_mode":"100644","git_object":"45176137de939aed33597159a77b20167a70a0d6","path":"calib/profiles/board_110x40_warehouse_story_v1/zones.yaml","sha256":"ce5b2e2991a0a2edf96c0848afbe7d0f0a437ade9cf2abbcabc9c4990802432a"},{"classification":"explicit_site_input","git_mode":"100644","git_object":"281b1fd02a1ce452241ccf3599a2e451205f9836","path":"calib/profiles/board_110x40_warehouse_story_v1_fusion/anchors.yaml","sha256":"f409c0865d67592ce85fe5a466030ceecda6170462ab8cf24c01e5ec711eeaca"},{"classification":"explicit_site_input","git_mode":"100644","git_object":"71b6943972432b532ee886550682033ddc143c24","path":"calib/profiles/board_110x40_warehouse_story_v1_fusion/cam0/camera.yaml","sha256":"102abcfa648e51f0b4184ccf06bc9a223f68a940f0c05e245b6f66c335262788"},{"classification":"explicit_site_input","git_mode":"100644","git_object":"7a0f87db02b526e78c79b4aebf1e5c02c3473313","path":"calib/profiles/board_110x40_warehouse_story_v1_fusion/cam0/mapping.yaml","sha256":"2798e4a3f6106ee8d620e7e720cf2d06a479742cfb722bb54cbd89a88da8be82"},{"classification":"explicit_site_input","git_mode":"100644","git_object":"792f24729b39a5f6b14bc20cda8fd9a63311207d","path":"calib/profiles/board_110x40_warehouse_story_v1_fusion/cam0/mapping_no_undistort.yaml","sha256":"016ea5344b4a6f015e9479f38ce5c1f8d17b9240f0a2a16626dd48ab6696c916"},{"classification":"explicit_site_input","git_mode":"100644","git_object":"8a63054bc3cd22e523a25af667772af0057127be","path":"calib/profiles/board_110x40_warehouse_story_v1_fusion/cam0/mapping_raw.yaml","sha256":"19427ec0ebd482eda40f5c1d30d20243a2f0f30a2eba069c939bbfd61a6a8943"},{"classification":"explicit_site_input","git_mode":"100644","git_object":"c6e484cd4efaaa55b260de2a54700ca84e09a315","path":"calib/profiles/board_110x40_warehouse_story_v1_fusion/cam1/camera.yaml","sha256":"e765ee16895d809f849cdfadeaedee8fa3736c6eadde348870de4f1c8a7ccfbc"},{"classification":"explicit_site_input","git_mode":"100644","git_object":"ffc2eb76eade674d7975236e39f0eaef942a589d","path":"calib/profiles/board_110x40_warehouse_story_v1_fusion/cam1/mapping.yaml","sha256":"d45b8fc4506b8116990b22a9be788996a98c9df1dd62f1da60c282f062f73671"},{"classification":"explicit_site_input","git_mode":"100644","git_object":"d379eb47709c8e6731d1081fba17e72935f92231","path":"calib/profiles/board_110x40_warehouse_story_v1_fusion/cam1/mapping_raw.yaml","sha256":"c8d865b6f668350b028931589fe52a05d168a1c1f94e877a139db03ea5d60bc4"},{"classification":"explicit_site_input","git_mode":"100644","git_object":"45176137de939aed33597159a77b20167a70a0d6","path":"calib/profiles/board_110x40_warehouse_story_v1_fusion/zones.yaml","sha256":"ce5b2e2991a0a2edf96c0848afbe7d0f0a437ade9cf2abbcabc9c4990802432a"},{"classification":"explicit_site_input","git_mode":"100644","git_object":"3cb2a904e887f1be5a7f0ff8b0e49c09860b8390","path":"calib/profiles/board_55x40_warehouse_story_v1_fusion/anchors.yaml","sha256":"f83e2aa581c3863fe5a9d4a5960e82584c158e947d985bf830c35584f97375c7"},{"classification":"explicit_site_input","git_mode":"100644","git_object":"71b6943972432b532ee886550682033ddc143c24","path":"calib/profiles/board_55x40_warehouse_story_v1_fusion/cam0/camera.yaml","sha256":"102abcfa648e51f0b4184ccf06bc9a223f68a940f0c05e245b6f66c335262788"},{"classification":"explicit_site_input","git_mode":"120000","git_object":"e58d706d4d8cf06d95b274499c5727ca9f784b83","path":"calib/profiles/board_55x40_warehouse_story_v1_fusion/cam0/mapping.yaml","sha256":"021e40d7450d5144966ab904b3ffd1a0c06d327b8d5839f6e4f5c52b028ec075"},{"classification":"explicit_site_input","git_mode":"100644","git_object":"48b766fc72e0ff641d850a6d567a6de5836819b1","path":"calib/profiles/board_55x40_warehouse_story_v1_fusion/cam0/mapping_BAD_do_not_use.yaml","sha256":"08106f25c0e34485a1352764bb5d5d390e83a343f9e0e1a55649c17b3d076374"},{"classification":"explicit_site_input","git_mode":"100644","git_object":"f05a5e5ab1e04218823f7ae8436fade3ce98a9d3","path":"calib/profiles/board_55x40_warehouse_story_v1_fusion/cam0/mapping_intrinsics_backup.yaml","sha256":"966f946322501464ecc585193ec84c39abf462525409a90bcce7fc0068d20bf7"},{"classification":"explicit_site_input","git_mode":"100644","git_object":"a9ba592b94266782786c17553e37d7eaa3177110","path":"calib/profiles/board_55x40_warehouse_story_v1_fusion/cam0/mapping_raw.yaml","sha256":"5ce6cd6c0683c03d00726a51be0999712de4fd1c9290c793927f12e2928837c0"},{"classification":"explicit_site_input","git_mode":"100644","git_object":"c6e484cd4efaaa55b260de2a54700ca84e09a315","path":"calib/profiles/board_55x40_warehouse_story_v1_fusion/cam1/camera.yaml","sha256":"e765ee16895d809f849cdfadeaedee8fa3736c6eadde348870de4f1c8a7ccfbc"},{"classification":"explicit_site_input","git_mode":"120000","git_object":"e58d706d4d8cf06d95b274499c5727ca9f784b83","path":"calib/profiles/board_55x40_warehouse_story_v1_fusion/cam1/mapping.yaml","sha256":"021e40d7450d5144966ab904b3ffd1a0c06d327b8d5839f6e4f5c52b028ec075"},{"classification":"explicit_site_input","git_mode":"100644","git_object":"eae93dcb0cbe307126a4e45c8cb3a31d9174bf0d","path":"calib/profiles/board_55x40_warehouse_story_v1_fusion/cam1/mapping_BAD_do_not_use.yaml","sha256":"a5c988a9